<?xml version="1.0" encoding="UTF-8"?>
<!DOCTYPE aaf-file SYSTEM "EPDerivationChain.dtd">

<aaf-file>

    <!-- Test UserComments property -->
    <top-level name="User Comments in Mob Slot Segment">
        <timeline-mob-slot edit-rate-denominator="1" edit-rate-numerator="1">
            <source-clip track-type="none">
                <comment value="Should Pass" name="Test Case 1"/>
                <lower-level>
                    <timeline-mob-slot edit-rate-denominator="1" edit-rate-numerator="1">
                        <eoc track-type="none"/>
                    </timeline-mob-slot>
                </lower-level>
            </source-clip>
        </timeline-mob-slot>
    </top-level>
    
    <top-level name="User Comments in CommentMarker">
		<event-mob-slot edit-rate-denominator="1" edit-rate-numerator="1">
            <sequence track-type="none">
				<comment-marker track-type="none">
                    <comment value="Should Pass" name="Test Case 2"/>
                </comment-marker>
            </sequence>
        </event-mob-slot>
    </top-level>
    
    <top-level name="Illegal User Comments">
        <timeline-mob-slot edit-rate-denominator="1" edit-rate-numerator="1">
			<sequence track-type="none">
                <sequence track-type="none">
                    <comment value="Should Fail" name="Test Case 3"/>
                    <eoc track-type="none"/>
                </sequence>
            </sequence>
        </timeline-mob-slot>
    </top-level>

	<!-- Test CommentMarkes in essence/non-essence tracks -->
    <!-- Note: Case 2 above tests CommentMarkers in non-essence tracks -->
    <top-level name="CommentMarker in Essence Track">
		<event-mob-slot edit-rate-denominator="1" edit-rate-numerator="1">
            <sequence track-type="audio">
				<comment-marker track-type="audio"/>
            </sequence>
        </event-mob-slot>
    </top-level>
    
    <top-level name="DescriptiveMarker in Essence Track">
		<event-mob-slot edit-rate-denominator="1" edit-rate-numerator="1">
            <sequence track-type="audio">
				<descriptive-marker track-type="audio"/>
            </sequence>
        </event-mob-slot>
    </top-level>

	<!-- NEED TO TEST A DESCRIPTIVE MARKER IN AN ESSENCE TRACK -->
    
    <!-- Test CommentMarkes in Mob Slots (and nested in mob slots) -->
    <!-- Note: "CommentMarker in Essence Track" above test tests nested in an event mob slot -->
    <top-level name="CommentMarker in Event Mob Slot">
		<event-mob-slot edit-rate-denominator="1" edit-rate-numerator="1">
			<comment-marker track-type="none"/>
        </event-mob-slot>
    </top-level>
    
    <top-level name="CommentMarker nested in Timeline Mob Slot">
		<timeline-mob-slot edit-rate-denominator="1" edit-rate-numerator="1">
            <sequence track-type="none">
				<comment-marker track-type="none"/>
            </sequence>
        </timeline-mob-slot>
    </top-level>
    
    <top-level name="CommentMarker in Timeline Mob Slot">
		<timeline-mob-slot edit-rate-denominator="1" edit-rate-numerator="1">
			<comment-marker track-type="none"/>
        </timeline-mob-slot>
    </top-level>
    
	<top-level name="CommentMarker nested in Static Mob Slot">
		<static-mob-slot>
            <sequence track-type="none">
				<comment-marker track-type="none"/>
            </sequence>
        </static-mob-slot>
    </top-level>
    
    <top-level name="CommentMarker in Static Mob Slot">
		<static-mob-slot>
			<comment-marker track-type="none"/>
        </static-mob-slot>
    </top-level>
    
    <!-- Note: "DescriptiveMarker in Essence Track" above test tests nested in an event mob slot -->
    <top-level name="DescriptiveMarker in Event Mob Slot">
		<event-mob-slot edit-rate-denominator="1" edit-rate-numerator="1">
			<descriptive-marker track-type="none"/>
        </event-mob-slot>
    </top-level>
    
    <top-level name="DescriptiveMarker nested in Timeline Mob Slot">
		<timeline-mob-slot edit-rate-denominator="1" edit-rate-numerator="1">
            <sequence track-type="none">
				<descriptive-marker track-type="none"/>
            </sequence>
        </timeline-mob-slot>
    </top-level>
    
    <top-level name="DescriptiveMarker in Timeline Mob Slot">
		<timeline-mob-slot edit-rate-denominator="1" edit-rate-numerator="1">
			<descriptive-marker track-type="none"/>
        </timeline-mob-slot>
    </top-level>
    
	<top-level name="DescriptiveMarker nested in Static Mob Slot">
		<static-mob-slot>
            <sequence track-type="none">
				<descriptive-marker track-type="none"/>
            </sequence>
        </static-mob-slot>
    </top-level>
    
    <top-level name="DescriptiveMarker in Static Mob Slot">
		<static-mob-slot>
			<descriptive-marker track-type="none"/>
        </static-mob-slot>
    </top-level>

</aaf-file>
