<?xml version="1.0" encoding="UTF-8"?>
<!DOCTYPE aaf-file SYSTEM "EPDerivationChain.dtd">

<aaf-file>

    <!-- Test all static tracks -->

    <clip name="Clip 1">
        <source-clip slot-type="static" edit-rate-denominator="1" edit-rate-numerator="1" track-type="audio">
            <file-source name="File Source 1" sample-rate-denominator="24" sample-rate-numerator="600">
                <eoc/>
            </file-source>
        </source-clip>
    </clip>
    <clip name="Clip 2">
        <source-clip slot-type="static" edit-rate-denominator="1" edit-rate-numerator="1" track-type="audio">
            <file-source name="File Source 1" sample-rate-denominator="24" sample-rate-numerator="1200000">
                <eoc/>
            </file-source>
        </source-clip>
    </clip>

</aaf-file>
